{
  "adapter_backend": "fake",
  "allow_external_calls": false,
  "allow_external_tools": false,
  "api_key": null,
  "api_key_env": "OPENAI_API_KEY",
  "experiment_backend": "fake",
  "experiment_replications": 5,
  "experiment_runner": null,
  "experiment_timeout_seconds": 10,
  "llm_max_candidates": 4,
  "llm_model": "gpt-5-mini",
  "proof_backend": "fake",
  "proof_executable": null,
  "proof_timeout_seconds": 10,
  "retrieval_api_key": null,
  "retrieval_api_key_env": "OPENALEX_API_KEY",
  "retrieval_backend": "fake",
  "retrieval_limit": 5,
  "reviewer_api_key": null,
  "reviewer_api_key_env": "OPENAI_API_KEY",
  "reviewer_backend": "fake",
  "reviewer_max_objections": 5,
  "reviewer_model": "gpt-5-mini",
  "use_llm_reviewers": false
}
